"PROJECT","DEUTSCH","ENGLISH"
"A01","Ressourcen und die Herausbildung von Ungleichheit. Rohstoffe und Kommunikationssysteme im prähistorischen Südosteuropa","Resources and the Emergence of Inequality: Raw Materials and Communication Systems in Prehistoric South-East Europe"
"A02","Viel Erz und wenig Wasser. Sozio-kultureller Wandel in Verbindung mit Ressourcennutzung in der jüngeren Vorgeschichte der iberischen Halbinsel","Many Ores and Little Water. Socio-Cultural Change in Connection with the Use of Resources in the Later Prehistory of the Iberian Peninsula"
"A03","Steine aus dem Süden. Der Austausch von Ressourcen zwischen Mesopotamien und dem Gebiet des Persischen Golfs","Stones from the South. Exchange of Resources between Mesopotamia and the Region of the Persian Gulf"
"A04","Die Entwicklung der Palast-RessourcenKulturen Syriens","The Development of Palace-ResourceCultures in Syria"
"A05","„Das Land, in dem Milch und Honig fließen“. Entwicklung und Bedeutung von Agrarressourcen im bronze- und eisenzeitlichen Palästina","""The Land flowing with Milk and Honey"". Development and Significance of Agrarian Resources in Bronze and Iron Age Palestine"
"A06","Politischer Kollaps als Folge ökonomischen Wandels? Ressourcenkontrolle am Übergang von der Bronze- zur Eisenzeit im Ostmittelmeerraum","Political Collapse as a Consequence of Economic Change? Control of Resources at the Transition from the Bronze to the Iron Age in the Eastern Mediterranean"