"IMAGE";"CONTENT"
"A01";"Das Teilprojekt möchte Änderungen der Verfügbarkeit und Nutzungsstrategien von Rohstoffen und technologischen Innovationen anhand von zwei Beispielregionen im prähistorischen Südosteuropa, dem Banat einerseits und der westlichen Schwarzmeerküste andererseits, untersuchen. In der Gegenüberstellung soll herausgearbeitet werden, wie diese Faktoren als Mittel der Bildung, Aufrechterhaltung und Veränderungen von sozialen Gruppen wirkten."
"A02";"In diesem Teilprojekt werden die Dynamiken und die Diversität der sozio-kulturellen Erscheinungsformen auf der iberischen Halbinsel in Relation zur Nutzung von Ressourcen umfassend in einer Langzeitperspektive vom dritten bis ersten Jahrtausend v. Chr. analysiert und rekonstruiert. Durch die geplanten Gegenüberstellungen detaillierter Studien in zwei Regionen mit deutlich verschiedenen Standortbedingungen ergibt sich die Chance Ressourcen als Faktoren in solchen Prozessen wesentlich deutlicher als bisher zu identifizieren."
"A03";"In dem Teilprojekt soll die Zirkulation von kulturellen Ressourcen im Bereich des Persischen Golfes untersucht und dabei die Stimulierung dieses Austausches, der vor allem auf den Erhalt wertvoller Steine, durch die mesopotamischen Stadtstaaten und Großreiche des 3. Jahrtausends v. Chr. abzielte, herausgearbeitet werden. Den Auswirkungen dieser weiträumigen Prozesse auf die Herausbildung von lokalen Ressourcen-Kulturen in der Golfregion wird ein besonderes Augenmerk geschenkt. Zu diesem Zweck soll ein archäologischer Survey in der iranischen Provinz Hormuzgan durchgeführt werden."
"A04";"Das Teilprojekt zielt darauf ab, das traditionelle Konzept der Palastwirtschaft für die syrischen Klein- und Mittelstaaten des 2. Jahrtausends v. Chr. durch ein Modell der Palast- RessourcenKulturen zu ersetzen und die Entwicklung dieser Systeme zu erforschen. Dieses neue Konzept stellt die gezielte Belegung von Materialien und Objekte mit kulturellem Symbolgehalt zu Zwecken der Herrschaftsstabilisierung in den Vordergrund. In einer Fallstudie wird die Bedeutung von Gütern aus wertvollen Materialien in palatialen Kontexten untersucht, eine zweite Fallstudie widmet sich dem sogenannten „Internationalen Stil“ als politische Ressource."
"A05";"Das Teilprojekt soll die landwirtschaftlichen Ressourcen Palästinas mit Schwerpunkt auf dem Ackerbau durch zwei Fallstudien erforschen (jeweils als Dissertationsprojekt): eine archäobotanische Fallstudie, welche die naturwissenschaftlichen und ethnologischen Quellen untersuchen wird, und eine biblisch archäologische Fallstudie zu den archäologischen, historischen und philologischen Quellen. Das Arbeitsprogramm wird dabei so strukturiert werden, dass eine möglichst enge Kooperation zwischen beiden Fallstudien erzielt werden kann."
"A06";"Das Teilprojekt betrachtet am Beispiel des Übergangs von der Bronze- zur Eisenzeit im Ostmittelmeerraum die Frage nach den Wechselwirkungen zwischen sozio-kulturellen Dynamiken und der Nutzung von Ressourcen. Während der ersten Phase des SFB sollen in einer Fallstudie archäologische Funde der südlichen Levante aus dem obengenannten Blickwinkel untersucht werden. In späteren Phasen des SFB werden weitere Fallstudien das Untersuchungsgebiet ausweiten um zu einem besseren Verständnis der wirtschaftlichen, politischen und historischen Vorgänge während des 13. und 12. Jhds. v. Chr. zu gelangen."